SentenceNo,SequenceNo,Speaker,Text,PolarityScore
130,49,O'MALLEY,"Look, none of this is easy. None of us has all the answers. But together as a city, we saved a lot of lives. It was about leadership. It was about principle. And it was about bringing people together.",0.0
131,50,COOPER,"Thank you, Governor.",0.0
132,51,O'MALLEY,Thank you.,0.0
133,52,COOPER,"Senator Webb, in 2006, you called affirmative action ""state-sponsored racism."" In 2010, you wrote an op/ed saying it discriminates against whites. Given that nearly half the Democratic Party is non-white, aren't you out of step with where the Democratic Party is now?",-0.16666666666666666
134,53,WEBB,"No, actually I believe that I am where the Democratic Party traditionally has been. The Democratic Party, and the reason I've decided to run as a Democrat, has been the party that gives people who otherwise have no voice in the corridors of power a voice. And that is not determined by race.",0.0
135,53,WEBB,"And as a clarification, I have always supported affirmative action for African Americans. That's the way the program was originally designed because of their unique history in this country, with slavery and the Jim Crow laws that followed. What I have discussed a number of times is the idea that when we create diversity programs that include everyone, quote, ""of color,"" other than whites, struggling whites like the families in the Appalachian mountains, we're not being true to the Democratic Party principle of elevating the level of consciousness among our people about the hardships that a lot of people who happen to be have -- by culture, by the way.",0.11249999999999999
136,54,COOPER,"Senator Webb, thank you very much.",0.26
137,54,COOPER,"Let's move on to some of the most pressing issues facing our country right now, some of the biggest issues right now in the headlines today. We're going to start with guns. The shooting in Oregon earlier this month, once again it brought the issue of guns into the national conversation. Over the last week, guns have been the most discussed political topic on Facebook by two to one.",0.35714285714285715
138,54,COOPER,"Senator Sanders, you voted against the Brady bill that mandated background checks and a waiting period. You also supported allowing riders to bring guns in checked bags on Amtrak trains. For a decade, you said that holding gun manufacturers legally responsible for mass shootings is a bad idea. Now, you say you're reconsidering that. Which is it? shield the gun companies from lawsuits or not?",-0.24999999999999992
139,55,SANDERS,"Let's begin, Anderson, by understanding that Bernie Sanders has a D-minus voting rating (ph) from the NRA. Let's also understand that back in 1988 when I first ran for the United States Congress, way back then, I told the gun owners of the state of Vermont and I told the people of the state of Vermont, a state which has virtually no gun control, that I supported a ban on assault weapons. And over the years, I have strongly avoided instant background checks, doing away with this terrible gun show loophole. And I think we've got to move aggressively at the federal level in dealing with the straw man purchasers.",0.08333333333333333
140,55,SANDERS,"Also I believe, and I've fought for, to understand that there are thousands of people in this country today who are suicidal, who are homicidal, but can't get the healthcare that they need, the mental healthcare, because they don't have insurance or they're too poor. I believe that everybody in this country who has a mental crisis has got to get mental health counseling immediately. ",-0.25
141,56,COOPER,Do you want to shield gun companies from lawsuits?,0.0
142,57,SANDERS,"Of course not. This was a large and complicated bill. There were provisions in it that I think made sense. For example, do I think that a gun shop in the state of Vermont that sells legally a gun to somebody, and that somebody goes out and does something crazy, that that gun shop owner should be held responsible? I don't.",-0.06666666666666665
143,57,SANDERS,"On the other hand, where you have manufacturers and where you have gun shops knowingly giving guns to criminals or aiding and abetting that, of course we should take action.",-0.012499999999999997
144,58,COOPER,"Secretary Clinton, is Bernie Sanders tough enough on guns?",-0.19444444444444445
145,59,CLINTON,"No, not at all. I think that we have to look at the fact that we lose 90 people a day from gun violence. This has gone on too long and it's time the entire country stood up against the NRA. The majority of our country...",0.0
146,59,CLINTON,(APPLAUSE),0.0
147,59,CLINTON,"... supports background checks, and even the majority of gun owners do.",0.0
148,59,CLINTON,"Senator Sanders did vote five times against the Brady bill. Since it was passed, more than 2 million prohibited purchases have been prevented. He also did vote, as he said, for this immunity provision. I voted against it. I was in the Senate at the same time. It wasn't that complicated to me. It was pretty straightforward to me that he was going to give immunity to the only industry in America. Everybody else has to be accountable, but not the gun manufacturers. And we need to stand up and say Enough of that. We're not going to let it continue.",0.20833333333333334
149,59,CLINTON,(APPLAUSE),0.0
150,60,COOPER,"We're going to bring you all in on this. But, Senator Sanders, you have to give a response.",0.0
151,61,SANDERS,"As a senator from a rural state, what I can tell Secretary Clinton, that all the shouting in the world is not going to do what I would hope all of us want, and that is keep guns out of the hands of people who should not have those guns and end this horrible violence that we are seeing.",-0.5
152,61,SANDERS,"I believe that there is a consensus in this country. A consensus has said we need to strengthen and expand instant background checks, do away with this gun show loophole, that we have to address the issue of mental health, that we have to deal with the strawman purchasing issue, and that when we develop that consensus, we can finally, finally do something to address this issue.",-0.03333333333333333
153,62,COOPER,"Governor O'Malley, you passed gun legislation as governor of Maryland, but you had a Democratic-controlled legislature. President Obama couldn't convince Congress to pass gun legislation after the massacres in Aurora, in Newtown, and Charleston. How can you?",0.0
154,63,O'MALLEY,"And, Anderson, I also had to overcome a lot of opposition in the leadership of my own party to get this done. Look, it's fine to talk about all of these things -- and I'm glad we're talking about these things -- but I've actually done them.",0.3055555555555556
155,63,O'MALLEY,"We passed comprehensive gun safety legislation, not by looking at the pollings or looking at what the polls said. We actually did it. And, Anderson, here tonight in our audience are two people that make this issue very, very real. Sandy and Lonnie Phillips are here from Colorado. And their daughter, Jessie, was one of those who lost their lives in that awful mass shooting in Aurora.",0.0
156,63,O'MALLEY,"Now, to try to transform their grief, they went to court, where sometimes progress does happen when you file in court, but in this case, you want to talk about a -- a rigged game, Senator? The game was rigged. A man had sold 4,000 rounds of military ammunition to this -- this person that killed their daughter, riddled her body with five bullets, and he didn't even ask where it was going.",-0.6000000000000001
157,63,O'MALLEY,"And not only did their case get thrown out of court, they were slapped with $200,000 in court fees because of the way that the NRA gets its way in our Congress and we take a backseat. It's time to stand up and pass comprehensive gun safety legislation as a nation.",0.0
158,63,O'MALLEY,(APPLAUSE),0.0
159,64,COOPER,"Senator Sanders, I want you to be able to respond, 30 seconds.",0.5
160,65,SANDERS,"I think the governor gave a very good example about the weaknesses in that law and I think we have to take another look at it. But here is the point, Governor. We can raise our voices, but I come from a rural state, and the views on gun control in rural states are different than in urban states, whether we like it or not.",0.0
161,65,SANDERS,"Our job is to bring people together around strong, commonsense gun legislation. I think there is a vast majority in this country who want to do the right thing, and I intend to lead the country in bringing our people together.",0.14285714285714285
162,66,O'MALLEY,"Senator -- Senator, excuse me.",-0.05
163,66,O'MALLEY,(CROSSTALK),0.0
164,67,O'MALLEY,"Senator, it is not about rural -- Senator, it was not about rural and urban.",0.0
165,68,SANDERS,It's exactly about rural.,0.125
166,69,O'MALLEY,Have you ever been to the Eastern Shore? Have you ever been to Western Maryland? We were able to pass this and still respect the hunting traditions of people who live in our rural areas.,0.21212121212121213
167,70,SANDERS,Governor...,0.0
168,71,O'MALLEY,"And we did it by leading with principle, not by pandering to the NRA and backing down to the NRA.",-0.15555555555555559
169,72,SANDERS,"Well, as somebody who has a D-minus voting record...",0.0
170,72,SANDERS,(CROSSTALK),0.0
171,73,O'MALLEY,"And I have an F from the NRA, Senator.",0.0
172,74,SANDERS,I don't think I am pandering. But you have not been in the United States Congress.,0.0
173,75,O'MALLEY,"Well, maybe that's a healthy thing.",0.5
174,75,O'MALLEY,(LAUGHTER),0.0
175,76,SANDERS,"And when you want to, check it out. And if you think -- if you think that we can simply go forward and pass something tomorrow without bringing people together, you are sorely mistaken.",0.0
176,77,COOPER,"Let me bring in somebody who has a different viewpoint. Senator Webb, your rating from the NRA, you once had an A rating from the NRA. You've said gun violence goes down when more people are allowed to carry guns. Would encouraging more people to be armed be part of your response to a mass shooting?",0.5
177,78,WEBB,"Look, there are two fundamental issues that are involved in this discussion. We need to pay respect to both of them. The first is the issue of who should be kept from having guns and using firearms. And we have done not a good job on that.",0.25
178,78,WEBB,"A lot of them are criminals. And a lot of the people are getting killed are members of gangs inside our urban areas. And a lot of them are mentally incapacitated. And the shooting in Virginia Tech in '07, this individual had received medical care for mental illness from three different professionals who were not allowed to share the information.",-0.025
179,79,WEBB,So we do need background checks. We need to keep the people who should not have guns away from them. But we have to respect the tradition in this country of people who want to defend themselves and their family from violence.,0.0
180,80,COOPER,Senator...,0.0
181,81,WEBB,"May I? People are going back and forth here for 10 minutes here. There are people at high levels in this government who have bodyguards 24 hours a day, seven days a week. The average American does not have that, and deserves the right to be able to protect their family.",0.16
182,82,COOPER,"Senator -- Governor Chafee, you have an F rating from the NRA, what do you think about what Senator Webb just said?",0.0
183,83,CHAFEE,"Yes, I have a good record of voting for gun commonsense safety legislation, but the reality is, despite these tragedies that happen time and time again, when legislators step up to pass commonsense gun safety legislation, the gun lobby moves in and tells the people they're coming to take away your guns.",0.7
184,83,CHAFEE,"And, they're successful at it, in Colorado and others states, the legislators that vote for commonsense gun safety measures then get defeated. I even saw in Rhode Island. So, I would bring the gun lobby in and say we've got to change this. Where can we find common ground? Wayne Lapierre from the NRA, whoever it is, the leaders. Come one, we've go to change this. We're not coming to take away your guns, we believe in the Second Amendment, but let's find common ground here.",0.75
185,84,COOPER,I want to...,0.0
186,85,O'MALLEY,"...Anderson, when the NRA wrote to everyone in our state -- when the NRA wrote to members in our state and told people with hunting traditions lies about what our comprehensive gun safety legislation is, I wrote right back to them and laid out what it actually did. And that's why, not only did we pass it, but the NRA didn't...",0.09523809523809523
187,86,SANDERS,...Excuse me...,0.0
188,87,O'MALLEY,...dare to petition a referendum...,0.0
189,88,SANDERS,...I want to make...,0.0
190,89,O'MALLEY,"...Because we built a public consensus... COOPER: ...I want to move on to another issue, which is in the headlines right now, another crisis making headlines.",0.14285714285714285
191,89,O'MALLEY,"Secretary Clinton, Russia, they're challenging the U.S. in Syria. According to U.S. intelligence, they've lied about who they're bombing. You spearheaded the reset with Russia. Did you underestimate the Russians, and as president, what would your response to Vladimir Putin be right now in Syria?",0.2857142857142857
192,90,CLINTON,"Well, first of all, we got a lot of business done with the Russians when Medvedev was the president, and not Putin. We got a nuclear arms deal, we got the Iranian sanctions, we got an ability to bring important material and equipment to our soldiers in Afghanistan.",0.4
193,90,CLINTON,"There's no doubt that when Putin came back in and said he was going to be President, that did change the relationship. We have to stand up to his bullying, and specifically in Syria, it is important -- and I applaud the administration because they are engaged in talks right now with the Russians to make it clear that they've got to be part of the solution to try to end that bloody conflict.",-0.0035714285714285865
194,90,CLINTON,"And, to -- provide safe zones so that people are not going to have to be flooding out of Syria at the rate they are. And, I think it's important too that the United States make it very clear to Putin that it's not acceptable for him to be in Syria creating more chaos, bombing people on behalf of Assad, and we can't do that if we don't take more of a leadership position, which is what I'm advocating.",0.3825
195,91,COOPER,"Senator Sanders, what would you do differently.",0.0
196,92,SANDERS,"Well, let's understand that when we talk about Syria, you're talking about a quagmire in a quagmire. You're talking about groups of people trying to overthrow Assad, other groups of people fighting ISIS. You're talking about people who are fighting ISIS using their guns to overthrow Assad, and vice versa.",-0.125
197,92,SANDERS,"I'm the former chairman of the Senate Veterans Committee, and in that capacity I learned a very powerful lesson about the cost of war, and I will do everything that I can to make sure that the United States does not get involved in another quagmire like we did in Iraq, the worst foreign policy blunder in the history of this country. We should be putting together a coalition of Arab countries who should be leading the effort. We should be supportive, but I do not support American ground troops in Syria.",-0.047
198,93,COOPER,"On this issue of foreign policy, I want to go to...",-0.125
199,94,CLINTON,"...Well, nobody does. Nobody does, Senator Sanders.",0.0
200,95,COOPER,I want to go to Dana Bash. Dana?,0.0
201,96,BASH,"Governor Chafee, you were the only Republican in the Senate to vote against the Iraq war. You say Secretary Clinton should be disqualified from the presidency because she voted in favor of using force in Iraq. She has since said that her vote was a mistake. Why isn't that good enough?",0.0
202,97,CHAFEE,"Well, we just heard Senator Sanders say that it's the worst decision in American history. That's very significant, the worst decision in American history, I just heard from Senator Sanders.",-0.1708333333333333
203,97,CHAFEE,"So, as we look ahead, if you're going to make those poor judgment calls, a critical time in our history, we just finished with the Vietnam era, getting back into another quagmire -- if you're looking ahead, and you're looking at someone who made that poor decision in 2002 to go into Iraq when there was no real evidence of weapons of mass destruction in Iraq -- I know because I did my homework, and, so, that's an indication of how someone will perform in the future. And that's what's important.",-0.15
204,97,CHAFEE,(APPLAUSE),0.0
205,98,BASH,"Secretary Clinton, he's questioning your judgment.",0.0
206,99,CLINTON,"Well, I recall very well being on a debate stage, I think, about 25 times with then Senator Obama, debating this very issue. After the election, he asked me to become Secretary of State.",0.2
207,99,CLINTON,"He valued my judgment, and I spent a lot of time with him...",-0.1
208,99,CLINTON,(APPLAUSE),0.0
209,99,CLINTON,"...in the Situation Room, going over some very difficult issues.",-0.65
210,99,CLINTON,"You know, I -- I agree completely. We don't want American troops on the ground in Syria. I never said that. What I said was we had to put together a coalition -- in fact, something that I worked on before I left the State Department -- to do, and yes, that it should include Arabs, people in the region.",0.0
211,99,CLINTON,"Because what I worry about is what will happen with ISIS gaining more territory, having more reach, and, frankly, posing a threat to our friends and neighbors in the region and far beyond.",0.3666666666666667
212,99,CLINTON,"So I think while you're talking about the tough decision that President Obama had to make about Osama bin Laden, where I was one of his few advisers, or putting together that coalition to impose sanctions on Iran -- I think I have a lot of evidence...",-0.29444444444444445
213,99,CLINTON,(CROSSTALK),0.0
214,100,BASH,"Senator Sanders -- Senator Sanders, I want to bring you in here. My question for you is, as a congressman, you voted against the Iraq War. You voted against the Gulf War. You're just talking about Syria, but under what circumstances would a President Sanders actually use force?",0.0
215,101,SANDERS,"Let me just respond to something the secretary said. First of all, she is talking about, as I understand it, a no-fly zone in Syria, which I think is a very dangerous situation. Could lead to real problems.",-0.265
216,101,SANDERS,"Second of all, I heard the same evidence from President Bush and Dick Cheney and Don Rumsfeld about why we should overthrow Saddam Hussein and get involved in the -- I would urge people to go to berniesanders.com, hear what I said in 2002. And I say, without any joy in my heart, that much of what I thought would happen about the destabilization, in fact, did happen.",0.0
217,101,SANDERS,So I think... ,0.0
218,102,BASH,All right.,0.2857142857142857
219,102,BASH,(APPLAUSE),0.0
220,103,SANDERS,"I think the president is trying very hard to thread a tough needle here, and that is to support those people who are against Assad, against ISIS, without getting us on the ground there, and that's the direction I believe we should have (inaudible).",-0.3840277777777778
221,104,COOPER,"But, Senator Sanders, you didn't answer the question. Under what -- under what circumstances would you actually use force?",0.0
222,105,SANDERS,"Well, obviously, I voted, when President Clinton said, ""let's stop ethnic cleansing in Kosovo,"" I voted for that. I voted to make sure that Osama bin Laden was held accountable in Afghanistan.",0.0
223,105,SANDERS,"When our country is threatened, or when our allies are threatened, I believe that we need coalitions to come together to address the major crises of this country. I do not support the United States getting involved in unilateral action.",0.0625
224,106,(UNKNOWN),You're at work with our allies.,0.0
225,106,(UNKNOWN),(CROSSTALK),0.0
226,107,COOPER,"I'm gonna bring you all in on this. Governor -- Governor O'Malley, Secretary Clinton...",0.0
227,108,SANDERS,I don't believe that any...,0.0
228,108,SANDERS,(CROSSTALK),0.0
229,109,COOPER,"Secretary Clinton voted to authorize military force in Iraq, supported more troops in Afghanistan. As Secretary of State, she wanted to arm Syrian rebels and push for the bombing of Libya. Is she too quick to use military force?",0.2
230,110,O'MALLEY,"Anderson, no president -- no commander in chief -- should take the military option off the table, even if most of us would agree that it should be the last option.",0.13333333333333333
231,110,O'MALLEY,"What disturbed people so much about -- and I would agree with Senator Sanders on this -- leading us into Iraq under false pretenses and telling us, as a people, that there were weapons of mass destruction there was -- was one of the worst blunders in modern American history.",-0.20000000000000004
232,110,O'MALLEY,"But the reason why people remain angry about it is because people feel like a lot of our legislators got railroaded in a war fever and by polls. And I remember being at a dinner shortly before that invasion. People were talking at -- and saying, ""it'll take us just a couple years to rebuild democracy,"" and I thought, ""has this world gone mad?""",-0.5
233,110,O'MALLEY,"Whenever we go -- and contrary to John Quincy Adams' advice -- ""searching the world for monsters to destroy,"" and when we use political might to take a -- at the expense of democratic principle, we hurt ourselves, and we hurt our (inaudible).",-0.1
234,111,COOPER,Does she -- does she want to use military force too rapidly?,-0.1
235,112,O'MALLEY,"I believe that, as president, I would not be so quick to pull for a military tool. I believe that a no-fly zone in Syria, at this time, actually, Secretary, would be a mistake.",0.0
236,112,O'MALLEY,"You have to enforce no-fly zones, and I believe, especially with the Russian air force in the air, it could lead to an escalation because of an accident that we would deeply regret.",0.0
237,112,O'MALLEY,"I support President Obama. I think we have to play a long game, and I think, ultimately -- you want to talk about blunders? I think Assad's invasion of Syria will be seen as a blunder.",-0.15
238,113,COOPER,"Governor O'Malley, just for the record, on the campaign trail, you've been saying that Secretary Clinton is always quick for the -- for the military intervention. Senator -- Secretary Clinton, you can respond.",0.11666666666666665
239,114,CLINTON,"Well, first of all, I...",0.25
240,115,WEBB,"Anderson, can I come into this discussion at some point?",0.0
241,116,COOPER,"Well -- yes, you'll be coming in next, but she was directly quoted, Senator.",0.05
242,117,WEBB,"Thank you. I've been standing over here for about ten minutes, trying.",0.0
243,118,COOPER,OK.,0.5
244,119,WEBB,It's just -- it's gone back and forth over there.,0.0
245,120,COOPER,Secretary?,0.0
246,121,CLINTON,"Well, I am in the middle, here, and...",0.0
247,121,CLINTON,(LAUGHTER),0.0
248,121,CLINTON,Lots of things coming from all directions.,0.0
249,122,WEBB,You got the lucky (inaudible).,0.3333333333333333
250,123,CLINTON,"You know, I have to say, I was very pleased when Governor O'Malley endorsed me for president in 2008, and I enjoyed his strong support in that campaign. And I consider him, obviously, a friend.",0.5277777777777778
251,123,CLINTON,"Let me say -- because there's a lot of loose talk going on here -- we are already flying in Syria just as we are flying in Iraq. The president has made a very tough decision. What I believe and why I have advocated that the no-fly zone -- which of course would be in a coalition -- be put on the table is because I'm trying to figure out what leverage we have to get Russia to the table. You know, diplomacy is not about getting to the perfect solution. It's about how you balance the risks.",0.0
252,124,COOPER,Thank you.,0.0
253,125,CLINTON,"And I think we have an opportunity here -- and I know that inside the administration this is being hotly debated -- to get that leverage to try to get the Russians to have to deal with everybody in the region and begin to move toward a political, diplomatic solution in Syria.",0.125
254,126,COOPER,"Thank you, Secretary.",0.0
255,126,COOPER,(CROSSTALK),0.0
256,127,COOPER,"Senator Webb, you said as president you would never have used military force in Libya and that the attack on the U.S. consulate in Benghazi was, in your words, ""inevitable."" Should Secretary Clinton have seen that attack coming?",-0.05
257,128,WEBB,"Look, let's start -- I've been trying to get in this conversation for about 10 minutes -- let's start with why Russia is in Syria right now. There are three strategic failings that have allowed this to occur. The first was the invasion of Iraq, which destabilized ethnic elements in Iraq and empowered Iran. The second was the Arab Spring, which created huge vacuums in Libya and in Syria that allowed terrorist movements to move in there. And the third was the recent deal allowing Iran to move forward and eventually acquire a nuclear weapon, which sent bad signals, bad body language into the region about whether we are acquiescing in Iran becoming a stronger piece of the formula in that part of the world.",-0.18999999999999995
258,128,WEBB,"Now, I say this as someone who spent five years in the Pentagon and who opposed the war in Iraq, whose son fought in Iraq, I've fought in Vietnam. But if you want a place where we need to be in terms of our national strategy, a focus, the greatest strategic threat that we have right now is resolving our relationship with China. And we need to do this because of their aggression in the region. We need to do it because of the way they treat their own people.",0.6428571428571428
259,129,COOPER,Senator...,0.0
