SentenceNo,SequenceNo,Speaker,Text,PolarityScore
594,332,O'MALLEY,...but will become American citizens...,0.0
595,333,COOPER,"Senator Sanders, you talked about your record on the Veteran affairs committee. You served on that committee for the last eight years, including two years as its chairman while veterans died waiting for health care. You and Senator McCain ultimately addressed the issue with bi-partisan legislation. Why did it take 18 Inspector General reports, and a CNN investigation, and others, before you and your colleagues took action?",0.0
596,334,SANDERS,"Well, I was chairman for two years, and when I was chairman we did take action. What we did is pass a $15 billion dollar piece of legislation which brought in many, many new doctors, and nurses into the V.A. so that veterans in this country could get the health care when they needed it, and not be on long waiting lines.",0.37878787878787873
597,334,SANDERS,"And, the other part of that legislation said that if a veteran is living more than 40 miles away from a V.A. facility, that veteran could get health care from the community health center, or the private sector. As a result of that legislation, we went further in than any time in recent history in improving health care for the men and women of this country who put their lives on the line to defend them.",0.0
598,335,COOPER,"Governor Chafee, you and Hillary Clinton both voted for the Patriot Act which created the NSA surveillance program. You've emphasized civil liberties, privacy during your campaign. Aren't these two things in conflict?",0.0
599,336,CHAFEE,"No, that was another 99 to one vote for the Patriot Act, and it was seen as at the time modernizing our ability to do what we've always done to tap phones which always required a warrant. And I voted for that.",0.0
600,337,COOPER,Do you regret that vote?,0.0
601,338,CHAFEE,"No, no. As long as you're getting a warrant, I believe that under the Fourth Amendment, you should be able to do surveillance, but you need a warrant. That's what the Fourth Amendment says. And in the Patriot Act, section 215 started to get broadened too far. So I would be in favor of addressing and reforming section 215 of the Patriot Act.",0.15
602,339,COOPER,"Secretary Clinton, do you regret your vote on the Patriot Act?",0.0
603,340,CLINTON,"No, I don't. I think that it was necessary to make sure that we were able after 9/11 to put in place the security that we needed. And it is true that it did require that there be a process. What happened, however, is that the Bush administration began to chip away at that process. And I began to speak out about their use of warrantless surveillance and the other behavior that they engaged in.",0.3333333333333333
604,340,CLINTON,"We always have to keep the balance of civil liberties, privacy and security. It's not easy in a democracy, but we have to keep it in mind.",0.0
605,341,COOPER,"Senator -- Senator Sanders, you're the only one on this stage who voted against the Patriot Act in 2001...",0.0
606,341,COOPER,(APPLAUSE),0.0
607,342,SANDERS,It was 99 to one and I was maybe the one. I don't know.,0.0
608,343,COOPER,"... and the reauthorization votes. Let me ask you, if elected, would you shut down the NSA surveillance program?",-0.15555555555555559
609,344,SANDERS,I'm sorry?,-0.5
610,345,COOPER,Would you shut down the NSA surveillance program?,-0.15555555555555559
611,346,SANDERS,Absolutely. Of course.,0.2
612,347,COOPER,"You would, point blank.",0.0
613,348,SANDERS,"Well, I would shut down -- make -- I'd shut down what exists right now is that virtually every telephone call in this country ends up in a file at the NSA. That is unacceptable to me. But it's not just government surveillance. I think the government is involved in our e-mails; is involved in our websites. Corporate America is doing it as well.",-0.00846560846560849
614,348,SANDERS,"If we are a free country, we have the right to be free. Yes, we have to defend ourselves against terrorism, but there are ways to do that without impinging on our constitutional rights and our privacy rights.",0.0
615,349,O'MALLEY,"Anderson, the NSA...",0.0
616,350,COOPER,"Governor Chafee, Edward Snowden, is he a traitor or a hero?",0.0
617,351,CHAFEE,"No, I would bring him home. The courts have ruled that what he did -- what he did was say the American...",0.0
618,351,CHAFEE,(CROSSTALK),0.0
619,352,COOPER,"Bring him home, no jail time?",0.05
620,353,CHAFEE,... the American government was acting illegally. That's what the federal courts have said; what Snowden did showed that the American government was acting illegally for the Fourth Amendment. So I would bring him home.,-0.125
621,354,COOPER,"Secretary Clinton, hero or traitor?",0.0
622,355,CLINTON,He broke the laws of the United States. He could have been a whistleblower. He could have gotten all of the protections of being a whistleblower. He could have raised all the issues that he has raised. And I think there would have been a positive response to that.,0.0
623,356,COOPER,Should he do jail time?,-0.1
624,357,ClINTON,"In addition -- in addition, he stole very important information that has unfortunately fallen into a lot of the wrong hands. So I don't think he should be brought home without facing the music.",-0.16
625,358,COOPER,"Governor O'Malley, Snowden?",0.0
626,358,COOPER,(APPLAUSE),0.0
627,359,O'MALLEY,"Anderson, Snowden put a lot of Americans' lives at risk. Snowden broke the law. Whistleblowers do not run to Russia and try to get protection from Putin. If he really believes that, he should be back here.",0.0
628,360,COOPER,"Senator Sanders, Edward Snowden?",0.0
629,361,SANDERS,I think Snowden played a very important role in educating the American people to the degree in which our civil liberties and our constitutional rights are being undermined.,0.26
630,362,COOPER,Is he a hero?,0.0
631,363,SANDERS,"He did -- he did break the law, and I think there should be a penalty to that. But I think what he did in educating us should be taken into consideration before he is (inaudible).",0.0
632,364,COOPER,"Senator Webb, Edward Snowden?",0.0
633,365,WEBB,"I -- well, I -- I would leave his ultimate judgment to the legal system. Here's what I do believe. We have a serious problem in terms of the collection of personal information in this country. And one of the things that I did during the FISA bill in 2007, the Foreign Intelligence Surveillance Act, was introduce with Russ Feingold two amendments basically saying, ""We understand the realities of how you have to collect this broad information in the Internet age, but after a certain period of time, you need to destroy the personal information that you have if people have not been brought -- if criminal justice proceedings have not been brought against them.""",-0.07470238095238096
634,365,WEBB,We've got a vast data bank of information that is ripe for people with bad intentions to be able to use. And they need to be destroyed.,-0.06666666666666661
635,366,COOPER,"Another -- another question for each of you, starting with Governor Chafee.",0.0
636,366,COOPER,Name the one thing -- the one way that your administration would not be a third term of President Obama.,0.0
637,367,CHAFEE,"Certainly, ending the wars. We've got to stop these wars. You have to have a new dynamic, a new paradigm. We just spent a half-billion dollars arming and training soldiers, the rebel soldiers in Syria. They quickly join the other side. We bombed the...",-0.1
638,367,CHAFEE,(CROSSTALK),0.0
639,368,COOPER,President Obama's generals right now are suggesting keeping troops in Afghanistan after the time he wanted them pulled out. Would you keep them there?,0.2857142857142857
640,369,CHAFEE,I'd like to finish my question -- my answer.,0.0
641,369,CHAFEE,And also we just bombed a hospital. We've had drone strikes that hit civilian weddings. So I would change how we -- our approach to the Middle East. We need a new paradigm in the Middle East.,0.0
642,370,COOPER,"Governor O'Malley, how would you be different than President Obama's administration?",0.0
643,371,O'MALLEY,"I would follow through on the promise that the American people thought we made as Democratic Party, to protect the Main Street economy from recklessness on Wall Street. I would push to separate out these too-big-to-jail, too-big-to-fail banks, and put in place Glass-Steagall, a modern Glass-Steagall that creates a firewall so that this wreckage of our economy can never happen again.",0.2
644,372,COOPER,"Secretary Clinton, how would you not be a third term of President Obama?",0.0
645,373,CLINTON,"Well, I think that's pretty obvious. I think being the first woman president would be quite a change from the presidents we've had up until this point, including President Obama.",0.25
646,374,COOPER,Is there a policy difference?,0.0
647,375,CLINTON,"Well, there's a lot that I would like to do to build on the successes of President Obama, but also, as I'm laying out, to go beyond. And that's in my economic plans, how I would deal with the prescription drug companies, how I would deal with college, how I would deal with a full range of issues that I've been talking about throughout this campaign to go further.",0.18333333333333335
648,376,COOPER,Senator Sanders?,0.0
649,377,SANDERS,"I have a lot of respect for president Obama. I have worked with him time and time again on many, many issues. But here's where I do disagree. I believe that the power of corporate America, the power of Wall Street, the power of the drug companies, the power of the corporate media is so great that the only way we really transform America and do the things that the middle class and working class desperately need is through a political revolution when millions of people begin to come together and stand up and say: Our government is going to work for all of us, not just a handful of billionaires.",0.05
650,377,SANDERS,(APPLAUSE),0.0
651,378,COOPER,"Senator Webb, how would you not be a third term for Obama?",0.0
652,379,WEBB,"I got a great deal of admiration and affection for Senator Sanders, but I -- Bernie, I don't think the revolution's going to come. And I don't think the Congress is going to pay for a lot of this stuff. And if there would be a major difference between my administration and the Obama administration, it would be in the use of executive authority.",0.0625
653,379,WEBB,"I came up as a committee counsel in the Congress, used to put dozens of bills through the House floor every year as a committee counsel on the Veterans Committee. I have a very strong feeling about how our federal system works and how we need to lead and energize the congressional process instead of allowing these divisions to continue to paralyze what we're doing. So I would lead -- working with both parties in the Congress and working through them in the traditional way that our Constitution sets (ph).",0.5633333333333334
654,380,COOPER,"Senator Sanders, he cited you. You don't hear a lot of Democratic presidential candidates talking about revolution. What do you mean?",0.0
655,381,SANDERS,"What I mean is that we need to have one of the larger voter turnouts in the world, not one of the lowest. We need to raise public consciousness. We need the American people to know what's going on in Washington in a way that today they do not know.",-0.15625
656,381,SANDERS,(APPLAUSE),0.0
657,381,SANDERS,"And when people come together in a way that does not exist now and are prepared to take on the big money interest, then we could bring the kind of change we need.",0.3
658,382,O'MALLEY,"Anderson, I actually have talked about a revolution. What we need is a green energy revolution. We need to move America to a 100 percent clean electric grid by 2050 and create 5 million jobs along the way.",0.3666666666666667
659,383,COOPER,"And we want to -- and we're going to talk more about climate change and environmental issues coming up. Some of the candidates have tried marijuana, as have pretty much -- probably everybody in this room.",0.5
660,383,COOPER,(LAUGHTER),0.0
661,383,COOPER,Others have not. Does that influence -- does it influence their views on legalization? Find out that and others ahead.,0.0
662,383,COOPER,(COMMERCIAL BREAK),0.0
663,384,COOPER,"And welcome back to this CNN Democratic presidential debate. It has been quite a night so far. We are in the final block of this debate. All the candidates are back, which I'm very happy to see.",0.4
664,384,COOPER,(LAUGHTER),0.0
665,385,COOPER,"It's a long story. Let's continue, shall we?",0.0
666,385,COOPER,"Secretary Clinton, welcome back.",0.4
667,386,CLINTON,"Well, thank you.",0.0
668,386,CLINTON,(LAUGHTER),0.0
669,387,CLINTON,"You know, it does take me a little longer. That's all I can say.",-0.1875
670,388,COOPER,"That's right. Secretary Clinton, Governor O'Malley says the presidency is not a crown to be passed back and forth between two royal families. This year has been the year of the outsider in politics, just ask Bernie Sanders. Why should Democrats embrace an insider like yourself?",0.0
671,389,CLINTON,"Well, I can't think of anything more of an outsider than electing the first woman president, but I'm not just running because I would be the first woman president.",0.3333333333333333
672,389,CLINTON,(APPLAUSE),0.0
673,390,CLINTON,"I'm running because I have a lifetime of experience in getting results and fighting for people, fighting for kids, for women, for families, fighting to even the odds. And I know what it takes to get things done. I know how to find common ground and I know how to stand my ground. And I think we're going to need both of those in Washington to get anything that we're talking about up here accomplished.",0.0
674,390,CLINTON,So I'm very happy that I have both the commitment of a lifetime and the experience of a lifetime to bring together to offer the American people.,0.5
675,391,COOPER,"Governor O'Malley, do you want to tell Secretary Clinton why she shouldn't get the crown?",0.0
676,392,O'MALLEY,"Well, actually, you know, we had this conversation. And I will share with you that I've traveled all around the country, Anderson, and there's two phrases I keep hearing again and again and again. And they're the phrases ""new leadership"" and ""getting things done.""",0.0
677,392,O'MALLEY,"We cannot be this dissatisfied with our gridlocked national politics and an economy where 70 percent of us are earning the same or less than we were 12 years ago, and think that a resort to old names is going to move us forward.",-0.022222222222222216
678,392,O'MALLEY,I respect what Secretary Clinton and her husband have done for our country. But our country needs new leadership to move forward.,0.0
679,393,COOPER,"Secretary Clinton, you have to be able to respond, if you want.",0.5
680,394,CLINTON,"Well, I would not ask anyone to vote for me based on my last name. I would ask them to listen to what I'm proposing, look at what I've accomplished in the Senate, as secretary of of state, and then draw your own conclusion.",0.4
681,394,CLINTON,"I certainly am not campaigning to become president because my last name is Clinton. I'm campaigning because I think I have the right combination of what the country needs, at this point, and I think I can take the fight to the Republicans, because we cannot afford a Republican to succeed Barack Obama as president of the United States.",0.2857142857142857
682,395,COOPER,(inaudible).,0.0
683,395,COOPER,(APPLAUSE),0.0
684,395,COOPER,"Senator Sanders, does she have the right stuff?",0.2857142857142857
685,396,SANDERS,"I think -- I think that there is profound frustration all over this country with establishment politics. I am the only candidate running for president who is not a billionaire, who has raised substantial sums of money, and I do not have a super PAC.",0.16666666666666666
686,396,SANDERS,(APPLAUSE),0.0
687,396,SANDERS,"I am not raising money from millionaires and billionaires, and in fact, tonight, in terms of what a political revolution is about, there are 4,000 house parties -- 100,000 people in this country -- watching this debate tonight who want real change in this country.",0.1
688,397,COOPER,"we've got -- we -- a lot of questions we've got about climate change, and we're gonna go to Don Lemon. Don?",0.0
689,398,LEMON,"All right. This one is for Martin O'Malley. Anderson, Governor O'Malley, this is from Anna Bettis from Tempe, Arizona. Here it is.",0.0
690,398,LEMON,(BEGIN VIDEO CLIP),0.0
691,399,QUESTION,"As a young person, I'm very concerned about climate change and how it will affect my future. As a presidential candidate, what will you do to address climate change?",0.10000000000000002
692,399,QUESTION,(END VIDEO CLIP),0.0
693,400,LEMON,"So, Governor O'Malley, please tell Anna how you would protect the environment better than all the other candidates up on that stage.",0.1875
694,401,O'MALLEY,Yeah.,0.0
695,401,O'MALLEY,"Anna, I have put forward a plan -- and I'm the only candidate, I believe, in either party to do this -- to move America forward to a 100 percent clean electric grid by 2050.",0.18333333333333335
696,401,O'MALLEY,"We did not land a man on the moon with an all-of-the-above strategy. It was an intentional engineering challenge, and we solved it as a nation. And our nation must solve this one.",0.0
697,401,O'MALLEY,"So I put forward the plan that would extend the investor tax credits for solar and for wind. If you go across Iowa, you see that 30 percent of their energy now comes from wind. We're here in Las Vegas, one of the most sustainable cities in America, doing important things in terms of green building, architecture and design.",0.2333333333333333
698,401,O'MALLEY,"We can get there as a nation, but it's going to require presidential leadership. And as president, I intend to sign as my very first order in office the -- an order that moves us as a nation and dedicates our resources to solving this problem and moving us to a 100 percent clean electric grid by 2050.",0.3458333333333333
699,402,COOPER,Governor...,0.0
700,403,O'MALLEY,We can do it.,0.0
701,404,COOPER,"...Governor O'Malley, thank you very much.",0.26
702,404,COOPER,(APPLAUSE),0.0
703,404,COOPER,"Senator Webb, you have a very different view than just about anybody else on this stage, and unlike a lot of Democrats. You're pro-coal, you're pro-offshore drilling, you're pro-Keystone pipeline. Are -- again, are you -- the question is, are you out of step with the Democratic party?",0.0
704,405,WEBB,"Well, the -- the question really is how are we going to solve energy problems here and in the global environment if you really want to address climate change?",0.13333333333333333
705,405,WEBB,"And when I was in the Senate, I was an all-of-the-above energy voter. We introduced legislation to bring in alternate energy as well as nuclear power. I'm a strong proponent of nuclear power. It is safe, it is clean. And really, we are not going to solve climate change simply with the laws here.",0.0
706,405,WEBB,"We've done a good job in this country since 1970. If you look at China and India, they're the greatest polluters in the world. Fifteen out of the 20 most polluted cities in the world are in one of those two countries. We need to solve this in a global way. It's a global problem and I have been very strong on -- on doing that. The -- the agreements -- the so-called agreements that we have had with China are illusory in terms of the immediate requirements of the -- of the Chinese government itself.",0.0
707,405,WEBB,"So let's solve this problem in an international way, and then we really will have a -- a way to address climate change.",0.1
708,406,COOPER,"Senator Sanders, are you tougher on -- on climate change than Secretary Clinton?",0.0
709,407,SANDERS,"Well, I will tell you this. I believe -- and Pope Francis made this point. This is a moral issue. The scientists are telling us that we need to move extremely boldly.",0.3333333333333333
710,407,SANDERS,"I am proud that, along with Senator Barbara Boxer, a few years ago, we introduced the first piece of climate change legislation which called for a tax on carbon.",0.2833333333333334
711,407,SANDERS,"And let me also tell you that nothing is gonna happen unless we are prepared to deal with campaign finance reform, because the fossil fuel industry is funding the Republican Party, which denies the reality of climate change...",0.0
712,407,SANDERS,(APPLAUSE),0.0
713,407,SANDERS,...and certainly is not prepared to go forward aggressively.,-0.10714285714285714
714,407,SANDERS,"This is a moral issue. We have got to be extremely aggressive in working with China, India, Russia.",-0.125
715,408,COOPER,"Senator -- thank you, Senator.",0.0
716,409,SANDERS,The planet -- the future of the planet is at stake.,0.0
717,410,COOPER,"Secretary Clinton, I want you to be able to respond, then I'm gonna go to (ph) (inaudible).",0.5
718,411,CLINTON,"Well, that -- that's exactly what I've been doing. When we met in Copenhagen in 2009 and, literally, President Obama and I were hunting for the Chinese, going throughout this huge convention center, because we knew we had to get them to agree to something. Because there will be no effective efforts against climate change unless China and India join with the rest of the world.",0.10000000000000002
719,411,CLINTON,"They told us they'd left for the airport; we found out they were having a secret meeting. We marched up, we broke in, we said, ""We've been looking all over for you. Let's sit down and talk about what we need to do."" And we did come up with the first international agreement that China has signed.",-0.2
720,411,CLINTON,"Thanks to President Obama's leadership, it's now gone much further.",0.1
721,412,COOPER,Thank you.,0.0
722,413,CLINTON,"And I do think that the bilateral agreement that President Obama made with the Chinese was significant. Now, it needs to go further, and there will be an international meeting at the end of this year, and we must get verifiable commitments to fight climate change from every country gathered there.",0.0
723,414,COOPER,Dana Bash?,0.0
724,415,BASH,"Secretary Clinton, you now support mandated paid family leave.",0.0
725,416,CLINTON,Mm-hmm.,0.0
726,417,BASH,"Carly Fiorina, the first female CEO of a Fortune 50 company, argues, if the government requires paid leave, it will force small businesses to, quote, ""hire fewer people and create fewer jobs."" What do you say not only to Carly Fiorina, but also a small-business owner out there who says, you know, I like this idea, but I just can't afford it?",0.0
727,418,CLINTON,"Well, I'm surprised she says that, because California has had a paid leave program for a number of years. And it's...",0.1
728,419,BASH,It's on the federal level.,0.0
729,420,CLINTON,"Well, but all -- well, on a state level, a state as big as many countries in the world. And it has not had the ill effects that the Republicans are always saying it will have. And I think this is -- this is typical Republican scare tactics. We can design a system and pay for it that does not put the burden on small businesses.",0.25
730,420,CLINTON,"I remember as a young mother, you know, having a baby wake up who was sick and I'm supposed to be in court, because I was practicing law. I know what it's like. And I think we need to recognize the incredible challenges that so many parents face, particularly working moms.",-0.30714285714285716
731,420,CLINTON,"I see my good friend, Senator Gillibrand, in the front row. She's been a champion of this. We need to get a consensus through this campaign, which is why I'm talking about it everywhere I go, and we need to join the rest of the advanced world in having it.",0.4
732,421,BASH,"But Secretary -- Secretary Clinton, even many people who agree with you might say, look, this is very hard to do, especially in today's day and age. There are so many people who say, ""Really? Another government program? Is that what you're proposing? And at the expense of taxpayer money?""",0.040277777777777767
733,422,CLINTON,"Well, look, you know, when people say that -- it's always the Republicans or their sympathizers who say, ""You can't have paid leave, you can't provide health care."" They don't mind having big government to interfere with a woman's right to choose and to try to take down Planned Parenthood. They're fine with big government when it comes to that. I'm sick of it.",0.0
734,422,CLINTON,(APPLAUSE),0.0
735,422,CLINTON,"You know, we can do these things.",0.0
736,422,CLINTON,(APPLAUSE),0.0
737,422,CLINTON,"We should not be paralyzed -- we should not be paralyzed by the Republicans and their constant refrain, ""big government this, big government that,"" that except for what they want to impose on the American people. I know we can afford it, because we're going to make the wealthy pay for it. That is the way to get it done.",0.0
738,423,COOPER,Thank you. Senator Sanders?,0.0
739,424,SANDERS,"Yeah, Dana, here's the point: Every other major country on Earth, every one, including some small countries, say that when a mother has a baby, she should stay home with that baby. We are the only major country. That is an international embarrassment that we do not provide family -- paid family and medical leave.",-0.10416666666666667
740,424,SANDERS,(APPLAUSE),0.0
741,424,SANDERS,"Second of all, the secretary is right. Republicans tell us we can't do anything except give tax breaks to billionaires and cut Social Security, Medicare, and Medicaid. That's not what the American people want.",0.03333333333333333
742,425,COOPER,Governor O'Malley?,0.0
